Front,Extra
" Víscera, em que se faz a digestão dos alimentos. Parte exterior do corpo, correspondente à região estomacal: _uma pancada no estômago_.  {c1::estômago}","Exemplo: HarvRef|Chrispeels|1994|p=25–57}} Os sistemas de produção mistos utilizam pastagens, culturas forrageiras e culturas de cereais como ração para gado ruminante e monogástrico (um estômago; principalmente galinhas e porcos)."
 Inflamação da mucosa da boca.  {c1::estomatite},"Exemplo: Johnson|primeiro=Larry}} À medida que a doença evolui, o paciente pode ter sinais e sintomas gerais de anemia como cansaço fácil, fraqueza, irritabilidade, indisposição, sonolência, cefaleia, dor nas pernas e apresentar glossite indolor, estomatite angular, unhas friáveis ou em colher (coiloníquia), cabelos finos, secos e quebradiços, pele seca, esclerótica azulada, mucosas descoradas, disfagia como resultado de membranas faríngeas (Síndrome de Paterson-Kelly ou Plummer-Vinson) e perversão do apetite."
 Estudo da boca e das suas moléstias.  {c1::estomatologia},"Exemplo: Ainda no segundo ano, os alunos começam atendimentos em clínica de estomatologia, odontologia preventiva e estomatologia."
 Qualidade de quem é vesgo.  {c1::estrabismo},"Exemplo: Livingstone, professora de neurobiologia na Harvard Medical School, sugere que Rembrandt, que era estrábico, sofria de alteração na estereopsia,''The New England Journal of Medicine'', 16 September 2004 uma impossibilidade ou dificuldade de enxergar tridimensionalmente."
"Cartan foi influenciado pelo trabalho dos irmãos Cosserat (1909), que consideravam, além de um (assimétrico) tensor força de {c1::estresse}, também um tensor momento de {c1::estresse} em um meio contínuo adequadamente generalizado.",
"au}} Um exemplo disto é ''Strongyloides stercoralis'', causador de {c1::estrongiloidíase} em humanos.",
svg|direita|thumb|Estrutura dos braços espirais da Via Láctea.,
PBPE|Estudo duplo-cego|ensaio clínico em dupla ocultação}} é um método de ensaio clínico realizado em '''seres humanos''' em que nem o examinado (objeto de estudo) nem o examinador sabem o que está sendo utilizado como variável em um dado momento.,
" Afroixamento das faculdades intelectuais, por doença. Paralisia. Hemiplegia.  {c1::estupor}",Exemplo: Apatia]] e inércia geral.
 Acto ou efeito de esvaziar.  {c1::esvaziamento},"Exemplo: Disto, decorreu o esvaziamento da Vila Operária."
"sfn|Kershaw|1999|pp=567–568}} As políticas de eugenia de Hitler miravam crianças com deficiências ou que tinham problemas de desenvolvimento em geral em um programa chamado de ''Kinder-Euthanasie,'' e depois ele autorizou um programa de {c1::eutanásia} para adultos com sérios problemas mentais e deficiências físicas, no que ficou conhecido como ''Aktion'' T4.",
 Acto de evacuar. Acto de sair de uma praça que estava ocupada militarmente. Acto de expelir os excrementos. Matérias evacuadas.  {c1::evacuação},"Exemplo: Quando não havia mais como defender a vila, o Capitão Sabino simulou haver aderido à revolta, mas disparou um canhão, causando pânico entre os balaios, resultando na evacuação da vila."
 Acto de evadir-se.  {c1::evasão},"Exemplo: Para acompanhar o desenvolvimento da região sudeste da colônia, e impedir a evasão fiscal e o contrabando de ouro, Portugal transferiu a capital do Estado do Brasil para o Rio de Janeiro."
" Hérnia, nas paredes abdominais, em resultado de uma abertura acidental. Ferida penetrante do abdómen, dando saída a uma porção de vísceras.  {c1::eventração}",
" Acto de mover-se progressivamente: _em política, prefere-se a evolução à revolução_. Desenvolvimento. Movimento regular de tropas ou de uma esquadra ou de um navio, mudando de posição. Giros de algumas aves, voando.  {c1::evolução}","Exemplo: Preocupada com a evolução, a física e a química de objetos celestes, bem como a formação e o desenvolvimento do universo."
 Acto ou efeito de exacerbar.  {c1::exacerbação},"Exemplo: Algumas das manifestações tradicionais guardam a natureza de espetáculos, que têm sido levados à exacerbação, convertendo-se em produto da cultura de massas."
" Observação ou investigação minuciosa e atenta. Análise; revista: _os médicos fizeram-lhe exame dos ferimentos_. Interrogatório. Demonstração, mais ou menos solene, de competência para o exercício de um cargo. Prova de habilitação ou não habilitação em algum ramo de conhecimentos humanos: _fez exame de inglês_.  {c1::exame}",Exemplo: Essas missões incluem ''fly-by missions'' com sensores remotos; veículos de aterrissagem que podem realizar experimentos no material da superfície; missões que permitem ver remotamente material enterrado; e missões de amostra que permitem um exame laboratorial direto.
O {c1::exame de sangue} e de pressão sanguínea estão entre os mais comumente métodos de diagnóstico investigativo que envolve o sangue.,
" Qualquer doença cutânea, caracterizada por uma vermelhidão mais ou menos viva, sem pústulas.  {c1::exantema}","Exemplo: lt;ref name=WHOCase2007/&gt; A erupção da pele, que ocorre entre 20% e 50% dos casos, apresenta-se no tronco na forma de exantema maculopapular."
 Acto de cortar. Amputação; ablação de uma parte de um todo.  {c1::excisão},"Exemplo: Estes incluem: (1) reparo de excisão de nucleotídeo, (2) reparo de incompatibilidade de DNA, (3) junção de extremidade não homóloga de quebras de fita dupla, (4) reparo recombinacional e (5) reparo dependente de luz (fotoreativação)."
" Acção, com que certos órgãos expelem de si as matérias sólidas ou líquidas que contém. Substância excrementícia.  {c1::excreção}","Exemplo: Tal como os répteis, as aves são seres uricotélicos; isto é, os seus rins filtram os resíduos nitrogenados da corrente sanguínea e excretam-nos na forma de ácido úrico (em vez de ureia ou amoníaco) ao longo dos uréteres até ao intestino."
" Acto de exercer ou de exercitar. Conjunto dos movimentos espontâneos do corpo. Movimentos calculados e metódicos, em ginástica. Aquilo com que se exercitam as faculdades morais e intelectuais. Recreio. Prática, uso. Manobras militares, para instrução.  {c1::exercício}","Exemplo: Uma das formas mais comuns e mais antigas consistia na datação consular, que consistia em nomear os dois ''consules ordinarii'' que iniciavam o seu exercício a 1 de Janeiro do ano civil."
"Procedimentos diagnósticos e terapêuticos adicionais incluem a {c1::exérese} da zona de transformação (EZT) e a conização, nas quais a camada interna do colo do útero é removida para ser examinada pelo patologista.",
"Essas enzimas são liberadas na forma de {c1::exocitose} quando ocorre a fusão da membrana do acrossomo com a membrana plasmática do espermatozoide, criando poros por onde as enzimas serão liberadas.",
 O mesmo que _exoftalmo_.  {c1::exoftalmia},"Exemplo: gov |língua=en-us |data=25 de maio de 2021}} O tipo mais comum é o rinocerebral, que infeta o nariz, seios paranasais, olhos e cérebro, e manifesta-se por congestão nasal, inchaço e dor de um dos lados da cara, dores de cabeça, febre, perturbações da visão, inchaço e protuberância do olho e necrose dos tecidos."
Supressão da {c1::expansão torácica} por contenção externa: sufocação indireta.,
 Acto de expectorar.  {c1::expectoração},"Exemplo: O capitão Longuinho tinha uma particularidade, ele utilizava contra os suspeitos do movimento um instrumento de tortura denominado colete de couro, que era molhado e costurado no tórax do pobre indivíduo, que quando estava seco, apertava e matava a vítima por asfixia ou expectoração sanguínea."
 Acto ou efeito de expulsar. Acto de expelir. Secreção.  {c1::expulsão},"Exemplo: quot;Nos diários de sua ''Viagem Filosófica'', traçou um amplo quadro das lavouras, procurando subsídios para o declínio da produção, sobretudo após a expulsão dos jesuítas."
" Efeito de estender. Qualidade daquilo que é extenso. Dimensão. Porção de espaço ou de tempo. Superfície. Operação, em que se estende a parte inferior de um osso fracturado. Doença no tendão flexor do pé do cavalo. Ampliação. Desenvolvimento. Intensidade. Vastidão: _a extensão do Oceano_.  {c1::extensão}","Exemplo: shtml|arquivodata=2012-01-19|urlmorta=yes}} As negociações de paz iniciaram-se em 1935 e, em 1938, um acordo final dava 237&amp;nbsp;800&amp;nbsp;km² de extensão territorial em litígio para o Paraguai."
 Acto ou efeito de extirpar.  {c1::extirpação},"Exemplo: A população da águia diminuiu devido à fragmentação da floresta e destruição de ninhos, resultando na quase extirpação da espécie."
 O mesmo que _extravasação_.  {c1::extravasamento},"Exemplo: a fim de que possa suprir as necessidades de hoje que são consideradas extravasamento de dados, ou seja, o usuário está postando muitos dados aleatoriamente e isso dificulta a localização."
O termo {c1::extubação} significa a remoção do tubo previamente introduzido.,
" Cansaço, resultante de trabalho excessivo. Faina; lida; trabalho.  {c1::fadiga}","Exemplo: html |website=CDC |acessodata=21 de novembro de 2018 |data=2 de outubro de 2018}} Os sintomas iniciais mais comuns são perda de memória, alterações no comportamento, falta de coordenação e perturbações visuais Entre os sintomas mais tardios estão demência, movimentos involuntários, perda de visão, fadiga e coma."
"lt;/ref&gt; No âmbito da medicina reprodutiva, é o resultado de uma {c1::falência orgânica} devido à disfunção dos órgãos reprodutores, dos gâmetas ou do concepto.",
" Cavidade músculo-membranosa, entre a boca e a parte superior do esófago.  {c1::faringe}","Exemplo: As fendas faríngeas embrionárias, que se formam em muitos animais quando as finas placas branquiais que separam as bolsas faríngeas e os sulcos faríngeos abrem, abrem a faringe até o exterior."
 Inflamação da faringe.  {c1::faringite},"Exemplo: id=-HRJOElZch8C&amp;pg=PA25}} Os sintomas ocorrem entre 40% e 90% dos casos e geralmente incluem febre, inchaço dos gânglios linfáticos, inflamação de garganta (laringite ou faringite), erupção cutânea, dor de cabeça e/ou feridas na boca e genitais."
 Relativo a farmácia.  {c1::farmacêutico},"Exemplo: Antônio Mariano Alberto de Oliveira''' (Saquarema, 28 de abril de 1857 — Niterói, 19 de Janeiro de 1937), mais conhecido como '''Alberto de Oliveira''', foi um poeta, professor e farmacêutico brasileiro."
" Parte da matéria médica, que tem por objecto fazer conhecer os medicamentos e ensinar a aplicação deles.  {c1::farmacologia}","Exemplo: Por sua vez, a fisiologia e a farmacologia pertenciam ao domínio da medicina."
"Il tradizionale simbolo fiorentino subì nel 1809 un attacco da parte di Napoleone Bonaparte che, con un decreto, provò a imporre un nuovo simbolo per Firenze: una pianta di giglio fiorito su un prato verde e uno sfondo argentato sormontato da una {c1::fascia} rossa e tre api dorate (simbolo dedicato alle grandi città dell'impero napoleonico).",
"Cada mama adere em sua base à parede torácica por uma {c1::fáscia} profunda, que cobre o músculo peitoral.",
lt;ref name=Surgery2009/&gt; Nas queimaduras elétricas pode ser necessário recorrer a {c1::fasciotomia}.,
Quando não tratado adequadamente o ''Streptococcus pyogenes'' pode destruir colágeno e fibras musculares debaixo da pele causando {c1::fascite} necrotizante.,
" Cada um dos aspectos diversos da Lua e de outros planetas, segundo a maneira, com que recebem a luz do Sol. Cada uma das modificações sucessivas que se notam em certas coisas: _as fases de uma questão_. Cada um dos diferentes aspectos que uma coisa apresenta sucessivamente: _as fases da vida_.  {c1::fase}","Exemplo: Com isso, é relativamente mais fácil de medir a amplitude e a fase das ondas de rádio."
" Estado mórbido, caracterizado pela aceleração do pulso e aumento de calor.  {c1::febre}","Exemplo: Cerca de 700 mil moradias foram destruídas, 3/4 das criações de animais pereceram, metade da frota pesqueira afundou, um milhão de acres de terras cultivadas foram salgadas por uma maré de tempestade de 3,5 metros que acompanhou o ciclone, os mananciais de água doce foram salgados e contaminados, e os sobreviventes sofreram com epidemias de febre tifoide, cólera, disenteria e outras doenças, além de fome, sede e falta de assistência médica e abrigo."
"Várias outras moléstias influenciadas pelo clima, como a leishmaniose, {c1::febre amarela}, filariose, febre do oeste do Nilo, doença de Lyme, ebola e várias arboviroses, provavelmente seguirão neste caminho.",
 Acto ou efeito de fecundar.  {c1::fecundação},Exemplo: O sistema reprodutor está preparado para fecundação interna e a maior parte das espécies possui um órgão copulatório.
"Pesquisadores tentarão reproduzir o grupo por meio de {c1::fecundação in vitro}, com material genético coletado do macho.",
 Gavela; braçado. Molho.  {c1::feixe},"Exemplo: Totalizando 10 anos, foi neste período que ele escreveu the ''Kitab al-Manazir'', o ''Livro de Óptica'', e quando, segundo as histórias, teve a ideia da Albait Almuzlim, câmera obscura em árabe, ao ver um feixe de luz atravessar um quarto escuro e perceber que ele projetava a imagem de objetos do lado de fora na parede contrária, descobrindo assim que a luz viaja em linha reta."
" Osso, que constitue a parte sólida da coxa da perna. Coxa. Nó superior das patas dos insectos.  {c1::fêmur}","Exemplo: A comparação do citocromo b mitocondrial e das sequências 12S de RNA ribossomal, isolados de um tarso de dodô e de um fêmur de solitário-de-rodrigues, confirmou o parentesco próximo entre essas duas aves, bem como sua classificação dentro da família Columbidae."
 Abertura de objecto fendido; fisga; racha.  {c1::fenda},"Exemplo: Entrevista para a ABC Radio National, 8/8/2004 As pitonisas proferiam seus oráculos em um estado de transe, sentadas sobre uma trípode que ficava sobre uma fenda rochosa no solo de onde saíam vapores subterrâneos, depois de mascarem folhas de loureiro e beberem água da fonte sagrada."
"Na verdade, cada família brasileira de antiga extração retrata no {c1::fenótipo} de seus membros características isoladas de ancestrais mais próximos ou mais remotos dos três grandes troncos formadores.",
 Chaga; golpe; úlcera.  {c1::ferida},"Exemplo: Na batalha que se seguiu Aquiles provocou no próprio Télefo uma ferida que não cicatrizava jamais; Télefo consultou um oráculo, que afirmou que &quot;aquele que feriu deverá curar&quot;."
" Reacção espontânea de um corpo orgânico, pela presença de um fermento que o decompõe.  {c1::fermentação}","Exemplo: Os bioquímicos utilizam ferramentas e conceitos da química e da biologia, particularmente da química orgânica, físico-química, fermentações e metabolismo, biologia celular, biologia molecular e genética, para a elucidação dos sistemas vivos e para sua aplicação tecnológica e industrial."
 Qualidade do que é fértil. Fecundidade.  {c1::fertilidade},"Exemplo: lt;ref name=&quot;:0&quot; /&gt; Por isso, o litoral leste continuou quase sem exploração até o início do século XVII, na época em que a fertilidade do solo para a lavoura e a pecuária foi verificada pelos europeus."
Os restantes animais desenvolvem {c1::feto}s no interior de uma placenta que os alimenta.,
" O mesmo que _fêvera_. Elemento anatómico, longo e frágil.  {c1::fibra}","Exemplo: In: ''Journal of Coastal Research'', 1995; (14):343-361 A elevação do nível do mar também compromete a estrutura de internet como redes de fibra ótica e centros de processamento de dados que foram projetados e construídos na década de 1990, quando o aquecimento global não era tão preocupante."
"pdf|título=Measuring overall health system performance for 191 countries|obra=WHO|wayb=20061230235518|urlmorta=sim}} O sistema de saúde é geralmente livre para as pessoas afetadas por doenças crônicas (''Affections de longues durées''), tais como câncer, AIDS ou {c1::fibrose} cística.",
"pdf|título=Measuring overall health system performance for 191 countries|obra=WHO|wayb=20061230235518|urlmorta=sim}} O sistema de saúde é geralmente livre para as pessoas afetadas por doenças crônicas (''Affections de longues durées''), tais como câncer, AIDS ou {c1::fibrose cística}.",
" Víscera volumosa, parte da qual produz a bílis, em-quanto a outra parte produz a substância açucarada que passa aos pulmões, servindo aos actos respiratórios.  {c1::fígado}","Exemplo: Por exemplo, um anatomista se preocupa com a forma, tamanho, posição, estrutura, suprimento sanguíneo e inervação de um órgão como o fígado; enquanto um fisiologista está interessado na produção de bile, o papel do fígado na nutrição e na regulação das funções corporais."
 Acto de filtrar.  {c1::filtração},"Exemplo: com/t452-alimentacao-dos-peixes|título=ALIMENTAÇÃO DOS PEIXES |acessodata=18 de abril de 2012}} que filtram à medida que &quot;respiram&quot;, com a ajuda de ''branquispinhas'', que são excrescências ósseas dos ''arcos branquiais'' (a estrutura que segura as brânquias ou guelras)."
" Aperto natural ou acidental, que não deixa que o prepúcio se retire para trás.  {c1::fimose}","Exemplo: O prepúcio pode estar envolvido em balanites, fimose, infecções sexualmente transmissíveis e câncer de pênis."
" Ciência, que trata das funções dos órgãos nos seres vivos, vegetais e animais. Tratado de Fisiologia.  {c1::fisiologia}","Exemplo: A anatomia distingue-se da fisiologia e da bioquímica, que estudam respetivamente as funções dessas partes e os processos químicos envolvidos."
"Apoiou as forças aliadas, denunciando no entanto a utilização da {c1::fissão} nuclear como uma arma.",
 Fenda. Úlcera na mucosa do ânus.  {c1::fissura},"Exemplo: Tétis (satélite)|Tétis]] possui uma fissura que possui grande extensão em sua superfície, enquanto Mimas possui uma enorme cratera de impacto."
São ainda comuns as fissuras e abcessos anais.,
" Úlcera, de abertura estreita, e comunicando com uma cavidade natural.  {c1::fístula}","Exemplo: lt;ref name=&quot;Hysinger2016&quot; /&gt; A traqueomalácia congênita pode ocorrer isoladamente ou em associação com outras anormalidades como broncomalácia ou laringomalácia, conexões anormais entre a traqueia e o esôfago, entre outras."
"Que pode ser ocasionado por doenças como Beribéri, {c1::fístula arteriovenosa}, hipertireoidismo, anemia ou qualquer outro fator que reduza a resistência periférica total.",
" Acto de fixar. Operação química, com que se torna fixo um corpo volátil.  {c1::fixação}","Exemplo: Como o próprio nome sugere, era um esboço de teoria, com as equações de movimento complementadas por condições adicionais de fixação de calibre."
 Estado ou qualidade daquilo que é flácido.  {c1::flacidez},"Exemplo: sfn|Speer|1971|pp=141–142}} De acordo com Speer, o Führer acreditava que a religião japonesa ou o islamismo seriam religiões melhores para os alemães do que o cristianismo, com sua &quot;mansidão e flacidez&quot;."
 Inflamação da membrana interna das veias.  {c1::flebite},"Exemplo: Além da já referida utilização por desportistas, é particularmente usada para casos de problemas digestivos, flebites, sinusites e como auxiliar de cura após cirurgia."
 Sangria; arte de sangrar.  {c1::flebotomia},"Exemplo: A sua aplicação em grande escala é hoje considerada como um dos episódios mais bárbaros da história da psiquiatria, sendo comum a sua comparação com a técnica da flebotomia (ou sangria) na história da medicina interna."
" Conjunto das plantas, que crescem em determinada região. Tratado, acerca dessas plantas. Pequeno planeta, entre Marte e Clio.  {c1::flora}","Exemplo: lt;ref name=&quot;iucn&quot;/&gt; Na Convenção sobre o Comércio Internacional das Espécies da Fauna e da Flora Silvestres Ameaçadas de Extinção (CITES) aparece no &quot;Appendix I&quot;, e pelo Ministério do Meio Ambiente como &quot;em perigo crítico&quot; desde 2003."
" Iluminação especial, que apresentam certas substâncias, quando expostas à acção dos raios químicos.  {c1::fluorescência}",Exemplo: Henri fez diversos estudos para investigar se uma substância fluorescente poderia emitir raios X quando era submetida à luz do sol.
" Preamar, enchente fluvial.  {c1::fluxo}","Exemplo: Acima do núcleo está a zona de radiação, onde o plasma se converte o fluxo de energia através da radiação."
" Designação genérica das diferentes espécies de medo mórbido, como agorafobia, a talassofobía, etc.  {c1::fobia}","Exemplo: volume=60}} Alguns alunos que estudam matemática podem desenvolver apreensão ou medo em relação ao seu desempenho na matéria, o que é conhecido como ansiedade matemática ou fobia matemática e é considerado o mais proeminente dos distúrbios que afetam o desempenho acadêmico."
 Inflamação dos folículos pilosos.  {c1::foliculite},"Exemplo: org|acessodata=7 de dezembro de 2016|citação=}} No entanto, a comunidade médica também viu um aumento recente na foliculite, ou infecção em torno do folículo piloso, em mulheres que depilam ou depilam as áreas do biquíni."
" Pequeno fole. Vesícula. Vagem de uma só sutura longitudinal. Pequena cavidade nas glândulas, entre as extremidades das artérias, veias e canais secretores.  {c1::folículo}","Exemplo: lt;ref name=pereira1980/&gt; A pele é ondulada, com pelos emergindo em ângulo agudo com folículos agrupados em três associados à glândulas sebáceas."
" Parte membranosa do crânio das crianças. Fonte aberta por operação cirúrgica, como revulsivo. Fontículo.  {c1::fontanela}","Exemplo: com/Health_and_Science/We-re-Born-With-270-Bones-As-Adults-We-Have-206|arquivodata=9 de dezembro de 2007}} Os bebês nascem com estruturas entre alguns ossos do crânio, chamadas fontanelas, popularmente chamadas &quot;moleiras&quot;."
" Abertura, cova.  {c1::forame}","Exemplo: Não há plexo coróide no corno anterior  No terceiro ventrículo existe uma pequena porção no teto que é contínua com a do corpo, via forames interventriculares, os canais que conectam os ventrículos laterais com o terceiro ventrículo."
" Expressão de um preceito ou de um principio. Receita, escrita por um médico ou indicada em algum receituário ou pharmacopeia. Expressão matemática, para resolver problemas análogos. Palavras, que servem invariavelmente na celebração de certos actos solenes.  {c1::fórmula}","Exemplo: Embora mais conhecido por sua fórmula de equivalência massa-energia, E = mc² — que foi chamada de &quot;a equação mais famosa do mundo&quot; —, foi laureado com o Prêmio Nobel de Física de 1921 &quot;por suas contribuições à física teórica&quot; e, especialmente, por sua descoberta da lei do efeito fotoelétrico, que foi fundamental no estabelecimento da teoria quântica."
" Cova. Cavidade subterrânea, em que se recolhem imundícies. Pequena cavidade natural no queixo ou na face.  {c1::fossa}",Exemplo: A parte anterior do cotovelo é denominada &quot;região cubital&quot; e a parte posterior &quot;região olecraniana&quot;.
 Aversão à luz.  {c1::fotofobia},"Exemplo: Alguns desenvolvem fotofobia (sensibilidade à luz forte), astenopia por forçar os olhos durante a leitura ou coceira no olho."
"A orografia açoriana apresenta-se muito acidentada, com linhas de relevo orientadas na direção Leste-Oeste, coincidentes com as linhas de {c1::fratura} que estão na génese das ilhas.",
O {c1::frênulo} é uma estrutura circular que pode ser encontrada logo após o prostômio.,
 Acto de friccionar. Medicamento para fomentações.  {c1::fricção},Exemplo: lt;/ref&gt; Cerca de 30 famílias de aves insetívoras apresentam cerdas muito curtas em toda a mandíbula que aumentam a fricção e lhes permitem segurar insetos de carapaça dura.
 Relativo a fronte: _osso frontal_.  {c1::frontal},"Exemplo: Defensor da primeira perspectiva, Murray Bookchin sustentava que o município deveria ser a base para relações sociais diretas, servindo como base para uma &quot;democracia frontal&quot; e para a &quot;intervenção pessoal do indivíduo&quot;, &quot;para que as freguesias, comunidades e cooperativas convirjam na formação de uma nova esfera pública&quot;."
 Que destrói os fungos ou fungões.  {c1::fungicida},"Exemplo: O ácido bórico têm propriedades antissépticas, fungicida e antiviral e por essas razões é utilizado como clarificador da água no tratamento de água em piscinas ."
 Excrescência na pele ou nas mucosas em forma de cogumelo. Fungão^2.  {c1::fungo},"Exemplo: Quanto a doenças, a mais grave e de de ocorrência generalizada é a fusariose ou gomose, causada pelo fungo ''Fusarium subglutinans&quot; f."
" Pequeno corpo cinzento e arredondado, que se encontra no trajecto dos nervos.  {c1::gânglio}",Exemplo: Os neurónios podem estar ligados entre si em gânglios nervosos.
" O mesmo que _laringe_. Parte interior do pescoço, por onde os alimentos passam da boca ao estômago. Pescoço. Gomo da cana de açúcar. Abertura estreita. Desfiladeiro; passagem estreita entre montanhas. Moldura reentrante.  {c1::garganta}","Exemplo: svg|thumb|Topografia de uma ave: 1 Bico, 2 Coroa, 3 Íris, 4 Pupila, 5 Manto, 6 Pequenas coberturas, 7 Escapulares, 8 Grandes coberturas, 9 Terciárias, 10 Uropígio, 11 Primárias, 12 Cloaca, 13 Coxa, 14 Articulação tíbiotársica, 15 Tarso, 16 Pata, 17 Tíbia, 18 Ventre, 19 Flancos, 20 Peito, 21 Garganta, 22 Papada, 23 Lista supraciliar."
