Front,Extra
"A prova tuberculínica (também conhecida como teste tuberculínico ou teste de Mantoux) está indicada para o diagnóstico da infecção latente, mas também auxilia no diagnóstico da doença em situações especiais, como no caso de crianças com suspeita de tuberculose.",
com/vulnerabilities---threats/hospital-medical-devices-used-as-weapons-in-cyberattacks/d/d-id/1320751|arquivodata=29 de Maio de 2016|df=dmy-all}} e dispositivos implantados incluindo {c1::marcapasso}s{{citar web|url=http://www.,
"Isso explicaria o uso de {c1::máscara cirúrgica}s em público, e o vício em remédios contra a dor.",
"Na época, desenvolveu um novo quadro de depressão, e devido a complicações do uso de silicone, desenvolveu um câncer de mama, necessitando realizar uma {c1::mastectomia}.",
 Designação genérica de inflamações nas mamas.  {c1::mastite},"Exemplo: htm|obra=Mundo Educação|acessodata=2020-06-07|lingua=pt-br|data=|publicado=|ultimo=Sardinha dos Santos|primeiro=Vanessa}} As doenças bacterianas também são importantes na agricultura, com bactérias que causam manchas nas folhas, queimadas e murchas nas plantas, assim como a doença de Johne, mastite, salmonela e antraz em animais de criação."
"Junto com os {c1::mastócito}s, também controlam mecanismos associados com a alergia e asma.",
 O mesmo que _mastozoologia_.  {c1::mastologia},"Exemplo: br/Artigos/Brasil/Sa%C3%BAde/Hospitais_que_se_destacam_no_Brasil/}} que, de acordo com a Sociedade Brasileira de Mastologia, atinge cerca de dois mil novos casos anualmente."
 O mesmo que _mastozoologia_.  {c1::mastologia},"Exemplo: br/Artigos/Brasil/Sa%C3%BAde/Hospitais_que_se_destacam_no_Brasil/}} que, de acordo com a Sociedade Brasileira de Mastologia, atinge cerca de dois mil novos casos anualmente."
 Disposição das partes constitutivas de uma máquina. Maquinismo. Organização de um todo.  {c1::mecanismo},"Exemplo: O primeiro historiador ou cronista a usar o Anno Domini como mecanismo de datação principal foi Vítor de Tununa, escritor africano do {{Séc|VII}}."
 Espaço entre cada uma das pleuras e a coluna vertebral.  {c1::mediastino},Exemplo: Cavidade pericárdica dentro do mediastino e.
 Acto de medicar; tratamento terapêutico.  {c1::medicação},"Exemplo: harvref|Studart|2006|p=20}} Em 1931 esteve internado em casas de saúde em Biarritz e em Orthez, no sul da França, onde tentou suicidar-se com sobredose de medicação."
" Substância, que se aplica externa ou internamente, para restabelecer a saúde; remédio.  {c1::medicamento}","Exemplo: Dentre os produtos industrializados de maior importância são contados a cerveja, impressos, navios, metais, medicamentos e roupas."
" Substância amarelada ou avermelhada, contida na cavidade dos ossos longos, nas cavidades celulares das extremidades desses ossos, no díploe dos ossos chatos. Miolo, contido no caule das plantas dicotiledóneas. _Espinhal medula_, substância, que ocupa o canal formado pelos arcos das vértebras e que forma o encéfalo.  {c1::medula}","Exemplo: lt;/ref&gt; O centauro encarregou-se da educação do jovem, alimentou-o com mel de abelhas, medula de ursos e de javalis e vísceras de leões."
"lt;/ref&gt; O centauro encarregou-se da educação do jovem, alimentou-o com mel de abelhas, medula de ursos e de javalis e vísceras de leões.",
"sfn|Humphries|2003|p=79}} A essa altura, já sofria de glaucoma, hipertensão, danos no fígado e {c1::megacólon}, cada um ampliado — e possivelmente causado — pelo abuso de medicamentos.",
 O mesmo que _melaína_.  {c1::melanina},"Exemplo: Os castanhos e os pretos são causados por melaninas sintetizadas pela ave e depositados em grânulos, enquanto os amarelos, laranjas e vermelhos são causados por carotenoides com origem na dieta e difundidos pela pele e penas."
 Tumor pigmentoso.  {c1::melanoma},"Exemplo: Em 2012, cerca de 14,1 milhões de novos casos de câncer ocorreram globalmente (excluindo casos de câncer de pele que não seja melanoma)."
" Tecido orgânico, mais ou menos laminoso, que envolve certos órgãos ou segrega certos líquidos. Película, que reveste certos órgãos vegetais. Película.  {c1::membrana}",Exemplo: O autor procura mostrar que os tímpanos de Stephen Jay Gould na realidade não existem e são de facto exaptações.
"lt;/ref&gt; Schmid-Tannwald e Kluge registraram uma tendência entre as meninas de terem a {c1::menarca} aproximadamente 1,3 anos mais cedo do que em uma pesquisa anterior de 1981.",
"Fibras predominantemente diversos tipos de colágenos, constituem os tendões, aponeuroses, cápsulas de órgãos, e membranas que envolvem o sistema nervoso central ({c1::meninge}s).",
"Outras condições médicas que afetam as meninges incluem a meningite (podendo esta ser causada por infecção fúngica, bacteriana, ou virótica) e os {c1::meningioma}s (tumor na meninge) surge nas meninges ou em tumores formados em outra parte do organismo que sofrem metástase para as meninges.",
" Inflamação das meninges, especialmente de aracnoide.  {c1::meningite}","Exemplo: Entre as doenças mais comuns, estão a dengue e a meningite, as quais estão alastrando-se por todo o território baiano e não apenas infectam os baianos, mas também provocam a morte."
 Vidro lenticular. Superfície curva de um líquido contido num tubo capilar. Figura geométrica com um lado convexo e outro côncavo.  {c1::menisco},Exemplo: Imagem:Menisco 18mL-2.
 Cessação do catamênio ou das regras; idade critica da mulher.  {c1::menopausa},"Exemplo: lt;ref name=&quot;Strier2007&quot; /&gt; No fim da vida, as fêmeas de catarrinos apresentam uma cessação na função reprodutiva, não ovulando mais, um fenômeno conhecido por menopausa: tal processo não foi largamente estudado em outros grupos."
"Porém os médicos especialistas fazem cálculos aproximados a partir do primeiro dia do último período menstrual normal (UPMN), normalmente com informações fornecidas pela gestante, da idade do embrião ou feto, haja vista que o ovócito só é fertilizado cerca de duas semanas depois da {c1::menstruação} precedente.",
 Relativo à mente; intelectual. Espiritual: _oração mental_.  {c1::mental},"Exemplo: lt;/ref&gt; discutem um ''gedankenexperiment'' (experimento mental) anterior realizado por Becker e Stigler, no qual foi proposto que a aplicação da lei fosse privatizada e explicam porque consideram que tal sistema não seria economicamente eficiente."
"Em um ambiente escuro, o pequeno gafanhoto observava Kouji silenciosamente sobre uma espécie de {c1::mesa cirúrgica}, onde outros dois seres encapuzados acompanhavam e comandavam a operação.",
" Membrana, em que estão suspensos os intestinos, e que lhes dá mobilidade.  {c1::mesentério}","Exemplo: Não existe uma clara demarcação quanto à divisão entre jejuno e íleo, embora existam diferenças importantes que distinguem os dois, como a parede, que é mais delgada no íleo, assim como a vasa recta se apresenta mais curta, em relação ao jejuno, e a maior deposição de tecido adiposo mesentérico nesta região."
 Mudança da natureza molecular dos corpos.  {c1::metabolismo},"Exemplo: Working Group I — Contribution to the Fifth Assessment Report of the Intergovernmental Panel on Climate Change, 2013 As reações químicas do metabolismo animal e vegetal são diretamente influenciadas pela temperatura do meio em que vivem."
"Compostos fenólicos'': a análise consiste na comparação entre a presença de {c1::metabolito}s secundários, como os flavonóides e antioxidantes.",
" Parte da mão, entre o carpo e os dedos.  {c1::metacarpo}","Exemplo: Na sequência, há os ossos que constituem a palma da mão, chamados de ossos metacarpais, numerados de um a cinco."
"Outra possível patologia de quem possui doença do refluxo gastroesofágico é o esôfago de Barrett onde o epitélio esofágico acaba por sofrer uma {c1::metaplasia} para tecido intestinal, caso o estresse causado pela acidez do refluxo permaneçam, é possível que essa {c1::metaplasia} evolua para uma neoplasia esofágica.",
" Figura de retórica, em que um orador lança à conta de outrem as coisas a que ele se refere. Alteração de uma doença, quanto à forma ou quanto à sede.  {c1::metástase}","Exemplo: Em organismos multicelulares, as células podem se mover durante processos como a desenvolvimento embrionário, assim como na cicatrização de feridas, na manutenção tecidual, no funcionamento do sistema imune e na metástase do câncer."
"Para evitar danos e otimizar o transporte de oxigênio para os tecidos, os eritrócitos (ou hemácias) têm uma enzima chamada {c1::metemoglobina}-redutase, que converte à forma ferrosa (Fe2+) a pequena quantidade de metHb que se forma espontaneamente.",
" Conjunto de processos racionais, para fazer qualquer coisa ou obter qualquer fim teórico ou prático. Modo de proceder. Classificação de diversos seres, segundo os caracteres que os aproximam. Tratado elementar.  {c1::método}","Exemplo: Portugal]] foi um dos últimos países a adotar o novo método, imposto pelo rei Dom João I, a 15 de Agosto de 1422, em substituição da &quot;era de César&quot;."
 Hemorragia do útero.  {c1::metrorragia},"Exemplo: html|titulo=Jornal diz que Kelly Key está grávida de 3 meses|publicação=Terra|acessodata= 18 de dezembro de 2010}} Porém, devido a uma metrorragia, Kelly sofreu um aborto espontâneo aos cinco meses de gestação."
 Acto de urinar.  {c1::micção},"Exemplo: Estes subprodutos são eventualmente expelidos do corpo em um processo conhecido como micção, o método primário para excretar do corpo substâncias químicas solúveis em água."
" Saliência esponjosa, em forma de cogumelo. Princípio açucarado da cravagem do centeio.  {c1::micose}","Exemplo: Os organismos envolvidos incluem bactérias patogênicas, causando doenças como peste, tuberculose e antraz; parasitas protozoários, causando doenças como malária, doença do sono, disenteria e toxoplasmose; e também fungos que causam doenças como micose, candidíase ou histoplasmose."
 Estudo ou tratado dos micróbios. (Cp. _microbiólogo_)  {c1::microbiologia},Exemplo: Alguns destes organismos &quot;semelhantes a plantas&quot; incluem: fungos (estudados em Micologia); bactérias e vírus (estudados em Microbiologia); e algas (estudadas em Ficologia).
"org/pss/2845499}} Outras pesquisas tem recentemente iniciado a categorizar outros tipos de biomas, como {c1::microbioma} humano e oceânico.",
"Pesquisas modernas provam que o Tuiná melhora a {c1::microcirculação} do sangue e do sistema linfático, que traz recuperação mais rápida para as várias lesões dos tecidos moles, tais como o deslocamento e a contusão.",
 Arte de usar o microscópio. Conjunto dos estudos microscópicos.  {c1::microscopia},Exemplo: Foi o aparecimento da microscopia que permitiu compreender os constituintes básicos dos tecidos vivos.
" Instrumento, para amplificar e representar próximos os objectos que por ele se observam.  {c1::microscópio}",Exemplo: O músculo liso não apresenta estrias quando observado ao microscópio.
" Substância medular, contida nos tubos nervosos.  {c1::mielina}",Exemplo: O fornix divide assim o hipotálamo numa '''zona medial''' (pobre em mielina) e uma '''zona lateral''' (rica em mielina).
"text bytes=""1129"" xml:space=""preserve"">A '''{c1::mielografia}''' é uma técnica através da qual se tira uma radiografia da medula espinal após uma injeção de um meio de contraste radiopaco na zona que se pretende examinar.",
"Caso com este não se consiga fazer um diagnóstico totalmente preciso é necessário outros exames mais sofisticados como, por vezes, o {c1::mielograma} ( usando uma amostra de medula óssea).",
 Afecção da medula-espinhal.  {c1::mielopatia},"Exemplo: Uma doença do sistema nervoso central, (mielopatia), impediu-o de tocar durante os últimos 11 anos da sua vida."
" Acto de passar de um país para outro, (falando-se de um povo ou de uma grande multidão de gente). Viagens periódicas ou irregulares, feitas por certas espécies de animais.  {c1::migração}","Exemplo: lt;ref name=hw34 /&gt; Tais processos são acompanhados por um crescimento significativo da imigração de trabalhadores, com aumentos sem precedentes na migração transoceânica e intracontinental e ao mesmo tempo por um desenvolvimento significativo das tecnologias em geral, em especial dos transportes e das comunicações."
" Que tem forma de grão de milho. Que tem pequenas dimensões, (falando-se de um animal).  {c1::miliar}",Exemplo: A ''causa mortis'' foi diagnosticada como febre miliar aguda.
" Qualquer substância inorgânica, que se encontra no interior ou na superfície da terra, como metais, pedras, combustíveis.  {c1::mineral}","Exemplo: O extrativismo mineral tem considerável importância em praticamente todos os países latino-americanos, ainda que muitas vezes a exploração seja realizada graças a capitais estrangeiros."
 Inflamação da substância muscular do coração.  {c1::miocardite},"Exemplo: Foi a angina de peito ou uma miocardite a causa da sua morte, em 1325."
" Tumor, formado principalmente de tecido muscular.  {c1::mioma}","Exemplo: Inicialmente era uma localidade da freguesia de Santa Maria do Sátão e assim se conservou desde o século XII até ao século XVI, em que, dividindo-se a freguesia do Sátão, o Avelal ficou a pertencer à de Mioma."
 Inflamação dos músculos.  {c1::miosite},"Exemplo: Em 2019 Peter Frampton anunciou que irá se aposentar dos palcos, após ter sido diagnosticado com miosite por corpúsculos de inclusão, uma doença degenerativa dos músculos que com o passar do tempo, o impedirá de tocar guitarra."
"A '''história do Afeganistão''' é marcada pela {c1::miscigenação} e pelo confluir da influência de diversos povos e civilizações asiáticas, devido à sua posição geográfica estratégica, numa zona de transição, de altos conflitos geopolíticos e de movimentos migratórios.",
"O material genético eucariótico é dividido em diferentes moléculas lineares chamadas cromossomas dentro de um núcleo discreto, geralmente com material genético adicional em algumas organelas como {c1::mitocôndria}s e cloroplastos.",
"As fases G1, G2 e S (replicação, dano e reparo do DNA) são consideradas a parte da interfase do ciclo, enquanto a fase M ({c1::mitose}) é a parte da divisão celular do ciclo.",
 Modo de ser. Restrição de certas proposições.  {c1::modalidade},Exemplo: estado conta com aproximadamente 21 times de clubes da modalidade.
 O mesmo que _modelação_.  {c1::modelagem},"Exemplo: Abrange tópicos como agronomia, melhoramento e genética de plantas, fitopatologia, modelagem de culturas, ciência do solo, entomologia, técnicas de produção e melhoramento, estudo de pragas e seu manejo e estudo de efeitos ambientais adversos, como degradação do solo, gerenciamento de resíduos e biorremediação."
 Acto ou efeito de modular.  {c1::modulação},"Exemplo: As células são capazes de sintetizar novas proteínas, essenciais para a modulação e manutenção das atividades celulares."
"Um exemplo é a '''{c1::mola hidatiforme}''', que é caracterizada pelo superdesenvolvimento dos tecidos trofoblásticos e pelo extremo subdesenvolvimento do embrião.",
" Pequenina parte de um corpo. A mais pequena parte de um corpo, a qual pode existir em liberdade.  {c1::molécula}","Exemplo: lt;ref name=laidler&gt;{{Harvnb|Laidler|2001|p=324}} Este argumento, que foi feito em 1913 em colaboração com Otto Stern, foi baseado na termodinâmica de uma molécula diatômica que pode se separar em dois átomos livres."
"Ambulâncias SIV''' - Possuem o mesmo material que as ambulâncias SBV, um {c1::monitor de sinais vitais}, um pace-maker externo, um desfibrilhador manual e uma mala médica com fármacos de emergência e acessórios para a sua preparação.",
"A elaboração de um conjunto significativo de mapas de ruído, a aquisição de equipamentos de medição, permite dispor no futuro próximo de instrumentos de {c1::monitorização} e de apoio ao ordenamento do território.",
"A {c1::monocitose} (aumento de monócitos no sangue), podem ser um indicativo de doenças crônicas como por exemplo, tuberculose, infecção por protozoários e artrite reumatoide, na qual, o paciente apresenta sintomas relacionados à causa da alteração.",
"pdf|formato=PDF|ano=2007|publicado=Organização Mundial da Saúde|local=Genebra|isbn=978-92-4-159562-9}} Muitos indivíduos desenvolvem uma doença semelhante à gripe ou à {c1::mononucleose} entre duas e quatro semanas após a exposição ao vírus, enquanto outras pessoas não têm sintomas significativos.",
"html|título=Cerca de 60 mil pessoas devem visitar cemitérios do Leste de Minas |autor=G1 |data=1/11/2016 |acessodata=30-08-2019 |wayb=20190830163155}} Em 2017, foram registrados {{fmtn|1341}} óbitos por {c1::morbidade}s, dentre os quais as doenças do sistema circulatório representaram a maior causa de mortes (26,54%), seguida pelos tumores (19,53%).",
 Qualidade do que é mortal. Obituário.  {c1::mortalidade},Exemplo: html|título=Alliance for Progress|data=2011|publicado=Infoplease|acessodata=6 de novembro de 2011}} Este empréstimo deveria ser utilizado principalmente em cinco áreas: incentivo aos programas de reforma agrária; construção de habitações populares mas de boa qualidade; redução da mortalidade infantil; distribuição equitativa da renda nacional; erradicação do analfabetismo.
 Faculdade de mover. Força motriz.  {c1::motilidade},"Exemplo: O reino Animalia, ou metazoários, é constituído por organismos multicelulares que são heterotróficos e móveis (embora alguns tenham evoluído para um estilo de vida estático)."
"As microvilosidades das células epidérmicas do seu corpo secretam uma cutícula fina, composta por fibras de escleroproteínas e {c1::mucopolissacarídeo}s.",
" Membrana, que segrega muco.  {c1::mucosa}",Exemplo: File:Normal gastric mucosa low mag.
 Acto ou efeito de mudar.  {c1::mudança},"Exemplo: Sfn|Bancal|1984|p=182}} Entretanto, há aspectos na obra de Proudhon que o distanciam do anarquismo, tais como posturas ambíguas em relação ao processo revolucionário, ora defendendo a violência e a revolução social e ora defendendo um processo gradual de mudança através de cooperativas mutualistas; ao próprio Estado, que em alguns momentos é duramente criticado e em outros considera-se a sua existência, ainda que de maneira descentralizada;{{Sfn|Corrêa|2014|p=155}} além de ter sustentado, em alguns momentos, conciliações entre a burguesia e o proletariado."
"Os jogos gladiatórios romanos frequentemente reverenciavam a mitologia clássica, e esta parece ser uma referência à luta de Aquiles contra a rainha amazona Pentesileia, com um toque curioso de mostrar o herói na forma de uma {c1::mulher}.",
" Acto ou efeito de multiplicar. Reprodução: _a multiplicação da espécie humana_. Operação aritmética, em que um número chamado _multiplicando_, se repete tantas vezes quantas são as unidades de outro, chamado _multiplicador_.  {c1::multiplicação}","Exemplo: O dicionário &quot;Vollständiges Mathematisches Lexicon&quot; (Leipzig, 1747) refere a palavra &quot;Algorithmus&quot;; nesta designação estão combinadas as noções de quatro cálculos aritméticos, nomeadamente a adição, multiplicação, subtração e divisão."
"Ausculta: {c1::murmúrio vesicular} abolido ou reduzido (silêncio), respiração raramente anfórica.",
" Órgão carnudo, formado pela reunião de muitas fibras, e que serve para operar movimentos, sob a influência da vontade ou de uma excitação orgânica ou mecânica.  {c1::músculo}","Exemplo: O coração das aves também apresenta arcos musculares, constituídos por camadas espessas de músculo."
" Mudança, alteração e substituição. Volubilidade, inconstância. Mudança de cenário, nos teatros.  {c1::mutação}","Exemplo: A mina de sal-gema, localizada em Loulé surgiu aquando da mutação geológica que resultou na separação entre a Europa e África, que criou o mar Mediterrânico, há 250&amp;nbsp;milhões de anos, ainda antes da era Jurássica."
"jpg|thumb|right|No dia da posse, Jânio desinfetou a cadeira alegando que &quot;{c1::nádegas} indevidas a usaram&quot;, referindo-se a Fernando Henrique Cardoso.",
" Tendência irresistível para o sono, manifestada como sintoma de algumas moléstias.  {c1::narcolepsia}","Exemplo: Os seres humanos podem sofrer de vários distúrbios do sono, incluindo dissonias como insônia, hipersonia, narcolepsia e apneia do sono; parassonias como sonambulismo e distúrbio comportamental do sono com movimento rápido dos olhos; bruxismo; e distúrbios do sono do ritmo circadiano."
 O mesmo que _narcotismo_.  {c1::narcose},"Exemplo: Uma mistura oxigênio-hélio é, às vezes, utilizada por mergulhadores em profundidades superiores a 55 m a fim de evitar que o efeito Paul Bert, um efeito letal do oxigênio em altas pressões, e a narcose por nitrogênio, um efeito que o gás possui além do limiar de sua pressão parcial."
" Relativo ao nariz. Que está no nariz ou faz parte do nariz: _as fossas nasais_. Diz-se do som, da letra ou da sílaba, cuja emissão ou cuja pronúncia é modificada pelo nariz. Fanhoso.  {c1::nasal}","Exemplo: pdf | arquivodata=2013-02-23 | coautor=Verheyden, Jouventin | acessodata=2016-02-22 | urlmorta=não }} A maior parte das aves apresenta duas narinas externas situadas no bico, geralmente com forma circular, oval ou em corte e ligadas à cavidade nasal no interior do crânio."
" Enjoo ou ânsia, produzida pelo balanço da embarcação, no mar.  {c1::náusea}","Exemplo: Os seus efeitos secundários incluem náuseas, vómitos, diarreia, menorragia e possibilidade de reações alérgicas."
 O mesmo que _autópsia_.  {c1::necropsia},"Exemplo: Silicose]], pois é comum o traficante adicionar talco industrial para aumentar seus lucros, fato verificado em necropsia, exame de hemogramas."
" Estado de um osso ou da parte de um osso, privada de vida. Doença dos vegetais, caracterizada por manchas negras, sob as quais tecidos se decompõem.  {c1::necrose}","Exemplo: Quando a célula completa seu processo de crescimento e se encontra danificada ou alterada, ela sofre morte celular, por apoptose ou necrose, para eliminar a ameaça que pode causar à sobrevivência do organismo."
 Extirpação total dos rins.  {c1::nefrectomia},Exemplo: A nefrectomia também é realizada quando alguém vai doar um rim para transplante renal.
"Manifestações raras incluem meningite aguda, que acontece em aproximadamente 2% de pacientes, hepatite, doença renal, gastrite, proctite, colite ulcerativa, artrite, periostite, neurite do nervo óptico, irite, e uveíte.",
 Tratado acerca dos rins.  {c1::nefrologia},"Exemplo: Entretanto, segundo censo feito em 2010 pela Sociedade Brasileira de Nefrologia, nos últimos dez anos, a hipertensão passou a ser o principal problema associado ao uso da diálise no Brasil."
 Tratado acerca dos rins.  {c1::nefrologia},"Exemplo: Entretanto, segundo censo feito em 2010 pela Sociedade Brasileira de Nefrologia, nos últimos dez anos, a hipertensão passou a ser o principal problema associado ao uso da diálise no Brasil."
"Enquanto as crianças são mais sensíveis aos efeitos do chumbo no sistema nervoso central, nos adultos as preocupações centram-se na neuropatia periférica, {c1::nefropatia} crónica e hipertensão.",
"Em junho de 2011, o Fundo de População das Nações Unidas divulgou um relatório sobre o estado da obstetrícia do mundo, contendo dados sobre a força de trabalho e as políticas relacionadas com a mortalidade {c1::neonatal} e materna em 58 países.",
"Serviço de Consultas Externas (Anestesiologia, Cardiologia, Cirurgia Geral, Diabetologia, Dor, Endocrinologia e Nutrição, Gastroenterologia, Ginecologia, Hematologia Clínica, Imunohemoterapia, Infecciologia, Medicina do Trabalho, Medicina Física e de Reabilitação, Medicina Interna, Neurologia, Nefrologia, Neonatologia, Obstetrícia, Oftalmologia, Oncologia Médica, Ortopedia, Otorrinolaringologia, Pneumologia, Psicologia, Psiquiatria Adultos, Psiquiatria da Infância e Adolescência, Senologia, Urologia.",
"Serviço de Consultas Externas (Anestesiologia, Cardiologia, Cirurgia Geral, Diabetologia, Dor, Endocrinologia e Nutrição, Gastroenterologia, Ginecologia, Hematologia Clínica, Imunohemoterapia, Infecciologia, Medicina do Trabalho, Medicina Física e de Reabilitação, Medicina Interna, Neurologia, Nefrologia, Neonatologia, Obstetrícia, Oftalmologia, Oncologia Médica, Ortopedia, Otorrinolaringologia, Pneumologia, Psicologia, Psiquiatria Adultos, Psiquiatria da Infância e Adolescência, Senologia, Urologia.",
 O mesmo que _neoplastia_. Néoformação patológica.  {c1::neoplasia},"Exemplo: As doenças relacionadas ao sistema circulatório são a principal causa de morte, sendo a segunda causa as doenças de Neoplasia."
" Cada um dos pequenos filamentos, que põem em comunicação o cérebro e a medula espinal com a circunferência do corpo, e que transmitem as sensações ao centro e as vontades à circunferência. Órgão de sensação e movimento nos animais.  {c1::nervo}","Exemplo: Os tecidos do corpo, incluindo os dos músculos, nervos e pele, são constituídos por células de vários tipos diferentes."
" Relativo a nervos. Que tem nervos. Que procede dos nervos ou tem a sua sede nos nervos. Enérgico; vigoroso. Excitado, exaltado. Que padece dos nervos. Que tem nervuras salientes.  {c1::nervoso}",Exemplo: jpg|thumb|Tecido nervoso de um nervo periférico.
