Front,Extra
"No estudo da Bioquímica diversos são os instrumentais de análise, em especial instrumentos e técnicas químicas, bioquímicas e biofísicas, tais como eletroforese, cromatografia (em especial HPLC/CLAE e gasosa), espectrofotometria, {c1::reação em cadeia da polimerase} (PCR), plasmídeos e tecnologia do DNA recombinante (engenharia genética),ensaios enzimáticos,   espectrometria de massas, ressonância magnética nuclear, ensaios de fluorescência (espectroscopia de fluorescência por exemplo), calorimetria de titulação isotérmica (ITC), biorreatores, ensaios de ligação de biomoléculas (Western Blot, ELISA), dicroísmo circular, PCR quantitativo, bioinformática, Sohxlet, destilação, centrifugação, Kjeldalhl, Demanda química de oxigênio (DQO), meios de cultura, entre outros que podem ser vistas nesta listagem: técnicas de laboratório.",
 Que recebe.  {c1::receptor},Exemplo: O contato direto célula-célula ocorre quando um receptor em uma célula se liga a uma molécula que está ligada à membrana de outra célula.
 Recaída numa enfermidade.  {c1::recidiva},"Exemplo: Bem como a organização de ajuda humanitária para as vítimas de fome e de surtos de cólera em 1892, ele passou a construir três escolas, um corpo de bombeiros e uma clínica médica, e a doar seus serviços médicos aos camponeses que viviam a quilômetros dali, apesar das frequentes recidivas de sua tuberculose."
 Acto ou efeito de reconstruir.  {c1::reconstrução},"Exemplo: Sfn|Corrêa|2014|p=129}} Para os anarquistas, o sujeito revolucionário deve ser criado em um processo longo, que exige a construção e reconstrução dos tecidos sociais, mobilizações, lutas, derrotas e vitórias; elementos objetivos e subjetivos, racionais e emocionais, não estando esse sujeito determinado ''a priori''; dentro da concepção anarquista, ele se forja historicamente, dentro dos processos de luta das classes dominadas contra as classes dominantes."
 Acto ou efeito de recuperar.  {c1::recuperação},"Exemplo: Bloomberg School of Public Health, Johns Hopkins University, 04/05/2008 A recuperação das nações pobres atingidas por desastres tão graves às vezes leva anos, só para em pouco tempo serem sujeitas a novos desastres, muitas delas estando localizadas em áreas naturalmente propensas a eles, como no sudeste asiático e no Caribe."
O {c1::refluxo vesicoureteral} refere-se ao refluxo de fluido da bexiga para os ureteres.,
" Acto ou efeito de regenerar. Partido politico português, formado em 1851.  {c1::regeneração}","Exemplo: Em 1833, com a reforma administrativa do Governador Bernardo Lobo de Souza, Mazagão perde o ''status'' de vila e é anexado a Macapá, sob o novo nome de &quot;Regeneração&quot;."
 Que pode regenerar.  {c1::regenerativo},"Exemplo: No SAF regenerativo, a maior quantidade e diversidade de biomassa permitem uma reciclagem e renovação de constante através de podas seletivas e introdução de espécies de modo a preservar a regeneração natural e/ou adensada."
 Acto ou efeito de regular.  {c1::regulação},"Exemplo: O capitalismo Laissez-faire abraça a noção de que os homens devem trocar bens e serviços, sem regulação, apenas com base no valor pelo valor."
"O tratamento de primeira linha é a terapia de {c1::reidratação} oral, em que os líquidos perdidos são repostos por soluções salinas e ligeiramente doces.",
"lt;ref name=&quot;:7&quot; /&gt; Se a cirurgia for considerada, geralmente envolve a recolocação dos ureteres em um local diferente na bexiga e a extensão da parte do ureter que está dentro da parede da bexiga, sendo a opção cirúrgica mais comum o {c1::reimplante} trigonal cruzado de Cohen.",
 Acto ou efeito de rejeitar.  {c1::rejeição},"Exemplo: lt;/ref&gt;{{Fonte melhor}} A partir dessas premissas, os anarcocapitalistas derivam como consequência lógica a rejeição total do Estado — como uma instituição que exerce o monopólio do poder sobre os habitantes de determinada região (em geral: país/nação/reino), onde seus representantes de governo afirmam ser legítimo — e a adoção da livre iniciativa, onde as agências privadas ofereceriam um mercado de serviços — empréstimos e segurança pública incluídos — para os indivíduos."
 O mesmo que _relaxação_.  {c1::relaxamento},"Exemplo: Embora tenha se apresentado em público para concertos de caridade e como um representante da Liga das Nações, Einstein não tocou principalmente para os espectadores, mas para se divertir com amigos — ou sozinho, para relaxamento e inspiração."
A ECT é administrada sob anestesia com um {c1::relaxante muscular}.,
" Aquilo que pode causar uma mudança salutar no organismo em geral ou num órgão especial. Aquilo que cura, ou a que se atribue a faculdade de curar. Expediente. Auxílio. Emenda.  {c1::remédio}",Exemplo: Esta teoria defendia a ideia de que cultura mais próxima do estado &quot;natural&quot; serviria de remédio aos males da civilização.
 Acto ou efeito de remittir. Falta de rigor. Indulgência; perdão: _a remissão dos pecados_. Interrupção. Desânimo. Froixidão. Remessa. Decrescimento temporário dos sintomas de uma doença. Remittência. Diminuição de intensidade.  {c1::remissão},"Exemplo: quote = E esta comida é chamada entre nós ''Eukharistia'' [a Eucaristia], da qual ninguém pode participar, exceto o homem que acredita que as coisas que ensinamos são verdadeiras e que foi lavado com a lavagem que é para a remissão dos pecados e para a regeneração, e que está vivendo como Cristo ordenou."
 Relativo aos rins.  {c1::renal},"Exemplo: jstor=1549093 |vauthors=Gribble N, Reynolds K |volume=13}}{{Citar periódico |título=Characterization of the Renal Portal System of the Common Green Iguana (Iguana iguana) by Digital Subtraction Imaging |periódico=Journal of Zoo and Wildlife Medicine |número=2 |ano=1999 |paginas=235–241 |pmid=10484138 |vauthors=Benson KG, Forrest L |volume=30}}{{Citar web|url=https://www."
Uma equipe liderada por Alberto Taquini e Eduardo Braun-Menéndez descobriu a angiotensina em 1939 e foi o primeiro a descrever a natureza enzimática do sistema {c1::renina}-angiotensina e seu papel na hipertensão.,
As mulheres que fazem terapia de {c1::reposição hormonal} têm um maior risco de desenvolver cânceres associados a esses hormônios.,
 Acto ou efeito de reproduzir.  {c1::reprodução},"Exemplo: Porém, segundo os dicionários Priberam, Aulete e Michaelis, em português &quot;antropogênico&quot; refere-se especificamente à antropogênese, a geração e reprodução humanas e às origens e desenvolvimento do homem como espécie[http://www."
"O mapeamento da {c1::reserva ovariana} de uma mulher, dinâmica folicular e biomarcadores associados podem dar um prognóstico individual sobre as chances futuras de gravidez, facilitando uma escolha informada de quando ter filhos.",
"html Eficácia da sibutramina na redução da {c1::resistência insulínica} e no controle glicêmico de pacientes obesos] Assim, o médico faz uma avaliação do tratamento para decidir a dose que o paciente deve receber (iniciando com uma dose de 10&amp;nbsp;mg) ou se irá descontinuá-lo, de acordo com a perda de peso durante o tratamento.",
 Acto ou efeito de respirar. Ambiente. Bafo.  {c1::respiração},"Exemplo: Como não possuem glândulas sudoríparas, o excesso de calor é dissipado pela respiração rápida que, em algumas espécies, pode chegar às 300 respirações por minuto."
" Operação cirúrgica, que consiste em cortar uma parte, mais ou menos extensa, de um órgão.  {c1::ressecção}","Exemplo: A ressecção cirúrgica pode ser feita com técnicas, como a incisão e sutura simples, ou com técnicas mais sofisticadas como a zetaplastia."
"Nos últimos séculos, os métodos de observação evoluíram de forma significativa, desde a dissecação de carcaças e cadáveres até às técnicas modernas de imagiologia médica, entre as quais radiografia, ecografia e {c1::ressonância magnética}.",
 Acto ou efeito de restaurar. Conserto; renovação: _restauração de um quadro_. Restabelecimento. Reacquisição da independencia nacional. Restabelecimento de uma dinastia.  {c1::restauração},"Exemplo: In: ''Britannia'', 1972; (3):182–208 Em 122 foi à Hispânia, passando o inverno em Tarraco, onde supervisionou a restauração do Templo de Augusto."
 Acto ou efeito de reter. Demora; detenção. Reserva. Retentiva. Cárcere privado. Acumulação de substâncias nas cavidades orgânicas donde normalmente são expelidas: _retenção de urinas_.  {c1::retenção},"Exemplo: Por efeito estufa entende-se a retenção de calor pela atmosfera, impedindo-o de se dissipar no espaço."
"O núcleo é expelido durante o processo de diferenciação de um eritroblasto em um {c1::reticulócito}, o precursor imediato dos eritrócitos maduros.",
" A mais interior membrana do olho, em que se formam as imagens, e que transmite a percepção ao cérebro por intermédio do nervo óptico.  {c1::retina}",Exemplo: lt;ref name = &quot;Gill&quot;/&gt; A retina das aves tem um sistema irrigatório próprio denominado pécten ocular.
"L'esperance|Francis L'Esperance]], para tratar uma {c1::retinopatia} em fevereiro de 1968.",
"Alguns vírus (por exemplo, os {c1::retrovírus}) têm RNA como seu material genético, mas eles não possuem célula, então não precisamos citá-los.",
" Dores, que têm a sua sede principal nos músculos e articulações, sem febre nem carácter inflamatório.  {c1::reumatismo}",Exemplo: Reumatologia]] &amp;#x2013; ramo da medicina que se ocupa do diagnóstico e tratamento das doenças reumáticas .
"Revista Brasileira de Reumatologia,http://www.",
"Revista Brasileira de Reumatologia,http://www.",
"Mais tarde naquela semana, em seu 68º aniversário, ele foi submetido a uma cirurgia quádrupla de {c1::revascularização} do miocárdio no Centro Médico da UCLA.",
 Inflamação da mucosa do nariz.  {c1::rinite},"Exemplo: Podem apresentar-se de forma sistêmica, envolvendo múltiplos órgãos, ou de modo mais restrito como na urticária e na rinite alérgica."
" Operação cirúrgica, com que se substitue artificialmente o nariz ou parte do nariz.  {c1::rinoplastia}",Exemplo: Ele se especializou em cirurgia plástica estética e até documentou uma operação de rinoplastia aberta.
" O mesmo que [[risca:1]]. Delineamento, traçado: _fazer o risco de um edifício_. Debuxo.  {c1::risco}","Exemplo: Inicialmente distraído por sua beleza, ele não lutou de maneira tão intensa quanto de costume; ao perceber, no entanto, que sua distração estava colocando em risco sua vida, devido às habilidades de combate da rainha guerreira, concentrou-se novamente e conseguiu matá-la."
Redução do {c1::risco cirúrgico} (IMC extremo com doenças associadas).,
rowspan=3 align=&quot;center&quot;|&quot;por suas descobertas de mecanismos moleculares que controlam o {c1::ritmo circadiano}&quot;{{citar web|título=The Nobel Prize in Physiology or Medicine 2017|url=http://www.,
Harvref|Herges|2005}} Os métodos híbridos que combinam dinâmica molecular com cálculo de mecânica quântica têm permitido a exploração dos estados eletrónicos das {c1::rodopsina}s.,
 Acto ou efeito de romper. Interrupção. Violação de contrato ou acordo. Quebra ou corte de relações sociais.  {c1::ruptura},"Exemplo: Nature News'', 09/09/2021 e pela primeira vez foram feitas avaliações das possibilidades de pontos de ruptura no clima global levando a mudanças catastróficas no sistema do clima."
 O açúcar comum.  {c1::sacarose},"Exemplo: São exemplos glicose, frutose,pentose, sacarose  lactose, amido."
As condições malignas requerem uma histerectomia abdominal total com {c1::salpingectomia} (retirada de trompas) e ooforectomia (retirada de ovários) de ambos lados.,
" Estabelecimento ou residência, apropriada para doentes ou convalescentes.  {c1::sanatório}","Exemplo: harvref|Cheniaux|2022|p=67}} Uma carta escrita em 1931 por um médico no sanatório de Orthez para um amigo do aeronauta o descreve como &quot;sofrendo de melancolia ansiosa com ilusões de culpa, culpa imaginária e a espera por punição."
"A manifestação clássica da trombocitopenia sintomática (menor que 50,000/mm3) é o {c1::sangramento}.",
 Relativo ao sangue. Que tem cor de sangue. Em cujo temperamento predomina o sangue. Sanguinolento; sanguinário.  {c1::sanguíneo},"Exemplo: No verão de 1950, seus médicos descobriram que um aneurisma — um vaso sanguíneo fraco — em sua aorta abdominal estava ficando maior."
 Relativo à saúde; relativo à higiene: _policia sanitária_.  {c1::sanitário},"Exemplo: lt;ref name=saude2009/&gt; Ainda em 2009, 83,05% da população amazonense tinha acesso à rede de água, enquanto 58% tinha acesso à rede de esgoto sanitário."
 Acto ou efeito de saponificar.  {c1::saponificação},"Exemplo: A catálise por base tem o inconveniente da reação de saponificação, formando o sal do ácido carboxílico."
" Tumor ou excrescência mórbida, com a consistência da carne.  {c1::sarcoma}","Exemplo: lt;/ref&gt; E em 1911, Peyton Rous transmitiu um tumor maligno de uma galinha para outra, descobrindo o vírus do sarcoma de Rous, e demonstrando que o câncer poderia ser transmitido por um vírus."
 Acto ou efeito de saturar.  {c1::saturação},"Exemplo: População residente, total, urbana total e urbana na sede municipal, em números absolutos e relativos, com indicação da área total e densidade demográfica, segundo as Unidades da Federação e os municípios – 2010|data=2010|publicado=Instituto Brasileiro de Geografia e Estatística|acessodata=16 de janeiro de 2014}} Isso não se deve à área do município, mas à saturação das áreas disponíveis, o que tem incentivado fortemente a verticalização das construções no município e a especulação imobiliária nas cidades da região metropolitana mais próximas da capital, como Nova Lima, Santa Luzia e Contagem, entre outras."
" Estado do que é são, ou de quem tem as funções orgânicas no seu estado normal. Vigor. Boa ou má disposição no organismo de um indivíduo. Saudação, brinde, acto de se beber à mesa em homenagem ou lembrança afetuosa de alguém: _ao jantar, houve muitas saúdes_.  {c1::saúde}","Exemplo: lt;ref name=&quot;Enciclopédia Delta Universal 427&quot;/&gt; Os Estados Unidos enviaram vários profissionais das áreas tecnológicas à América Latina para ajudá-la a desenvolver seus sistemas de agricultura, indústria e educação, e a melhorar os serviços de saúde."
" Propriedade dos tecidos orgânicos, em virtude da qual saem da substância deles as moléculas interiores que, segundo a sua natureza, são expelidas ou reabsorvidas ou fixadas nas cavidades do organismo. Substância segregada.  {c1::secreção}","Exemplo: A única glândula cutânea é a glândula uropigial perto da base da cauda, que produz uma secreção oleosa as aves usam para impermeabilizar as penas."
 Acto de sedar.  {c1::sedação},"Exemplo: Desenvolve tolerância em relação aos efeitos de euforia, de depressão respiratória, analgesia, sedação, vômitos e alterações hormonais."
 Hábitos sedentários.  {c1::sedentarismo},Exemplo: Estudos sobre a transição de sociedades caçadoras-coletoras para sociedades agrícolas indicam um período inicial de intensificação e aumento do sedentarismo; exemplos são a cultura natufiana no Levante e o neolítico chinês primitivo na China.
 Acto de segmentar.  {c1::segmentação},"Exemplo: Os insetos possuem corpos segmentados suportados por um exosqueleto rígido, constituído principalmente por quitina."
Este tipo de síncope pode também ocorrer quando é pressionada uma área do pescoço denominada {c1::seio carotídeo}.,
 Semente. Esperma.  {c1::sêmen},"Exemplo: Por meio desses microscópios simples observou e descreveu detalhadamente a partir de 1674 diversos tipos de materiais biológicos, como protozoários, embriões de plantas, glóbulos vermelhos do sangue e espermatozoides presentes no sêmen de animais."
" Que tem sementes, ou que produz sémen.  {c1::seminífero}","Exemplo: Todo o processo da espermatogênese é sustentado pelas células de Sertoli, que revestem o túbulo seminífero, nutrindo os espermatidíos."
" Qualidade do que é sensível. Propriedade de certas partes do sistema nervoso, pela qual os homens e os animais percebem as impressões causadas por objectos exteriores, ou produzidas interiormente. Impressionabilidade; susceptibilidade. Precisão, com que certos instrumentos ou aparelhos indicam a menor diferença ou alteração.  {c1::sensibilidade}","Exemplo: Enquanto Aquiles lamentava a morte de tão rara beleza, um notório tumultuador grego, chamado Térsites, começou a rir e caçoar dele, sugerindo que o herói estaria apaixonado pela falecida; perturbado com tamanha falta de sensibilidade e de respeito, Aquiles socou Térsites no rosto com fúria, matando-o imediatamente."
"Renato Russo faleceu no dia 11 de outubro de 1996, às 01h15 da madrugada, de doença pulmonar obstrutiva crônica, {c1::septicemia} e infecção urinária — consequências da AIDS (Renato era soropositivo desde 1989, mas nunca assumiu publicamente a doença).",
 Que causa putrefacção.  {c1::séptico},"Exemplo: url=}} O uso em larga escala destes antibióticos no tratamento de doenças bacterianas, como a tuberculose, sífilis, lepra, e muitas outras, começou no início do {{séc|XX}} e continua a desempenhar um papel principal na quimioterapia antibacteriana."
A {c1::septoplastia} é uma operação cirúrgica que ajuda a aliviar uma condição comum que pode levar a dificuldades respiratórias e problemas para dormir.,
"Em 1975 foi a vez de destacar as pesquisas sobre o {c1::sequenciamento} de DNA, sendo Allan Maxam, Walter Gilbert e Frederick Sanger os principais cientista envolvidos nestas pesquisas.",
" Bomba portátil, que atrai e expele o ar e os líquidos, e que serve especialmente para introduzir líquidos nas cavidades interiores do corpo.  {c1::seringa}","Exemplo: O médico acalmou-o, pegou uma seringa, deu-lhe uma injeção de cânfora, e pediu champanhe."
"Em comum com o homem ele tem  reações serológicas (ou sanguíneas) análogas, a possibilidade de enxerto testicular e a semelhança das circunvoluções do cérebro.",
"Para a farmacologia, do ponto de vista bioquímico, ele denota a substância como um alterador da percepção e da cognição que age sobre os receptores de {c1::serotonina}, igual o LSD.",
"lt;ref name=&quot;Joiner2016&quot; /&gt; Normalmente, não são necessárias investigações adicionais; no entanto, a {c1::sialografia}, a ultrassonografia e a tomografia computadorizada podem mostrar ar na glândula parótida e no ducto.",
 O mesmo ou melhor que _síndroma_.  {c1::síndrome},"Exemplo: Epidemias recentes de gripe aviária, Vírus Ebola e síndrome respiratória aguda grave, que custaram muitas vidas e enormes recursos financeiros, são exemplo dramáticos de zoonoses que provavelmente se tornarão mais frequentes, e sob certas circunstâncias podem degenerar em perigosas pandemias."
 Inflamação das membranas sinoviais.  {c1::sinovite},"Exemplo: Doenças inflamações''': artrites, sinovite, meningite, doenças inflamatórias intestinais."
" Fenómeno das funções ou da constituição material dos órgãos, próprio para indicar a natureza, existência ou sede de uma enfermidade.  {c1::sintoma}","Exemplo: harvref|Cheniaux|2022|p=66|loc=Other possible psychiatric manifestations}} Santos Dumont teria desenvolvido depressão em 1910, predatando o uso do avião na guerra, o que, de acordo com o artigo citado, indicaria que seu sentimento de culpa fosse um sintoma em vez da causa."
"As aves possuem também um órgão único entre os animais, a {c1::siringe}, que lhes permite produzir os cantos e chamamentos.",
"Imunologia]] — estuda a estrutura e função do {c1::sistema imunológico}, imunidade inata e adquirida, distinção corporal e técnicas laboratoriais envolvendo a interação de antígenos com anticorpos específicos.",
" Estado do coração, em que as fibras musculares deste órgão estão contraidas.  {c1::sístole}","Exemplo: Durante a sua ação, a bebida provoca aumento do diâmetro pupilar, da frequência respiratória, da pressão arterial, tanto diastólica quanto sistólica; e aumenta drasticamente as respostas neuroendócrinas para prolactina,cortisol e hormônio do crescimento plasmático."
" Acto ou efeito de situar. Sítio. Posição. Disposição recíproca das diferentes partes de um todo. Lugar, onde está uma coisa ou pessoa. Fase governamental ou ministerial. O Ministério ou Governo, relativamente à actualidade ou a uma dada época. Posição de um indivíduo, relativamente à sua profissão. Estado financeiro de um indivíduo ou de uma colectividade. Estado ou condição. Lance. Vicissitude; ocorrência.  {c1::situação}","Exemplo: Durante milhares de anos, as pessoas investigaram o espaço e a situação da Terra."
" Carga demasiada. Aquilo que se junta à carga. Aquilo que perturba o equilíbrio da carga. Espécie de cilha, com que se aperta a carga da besta. Marca, que as repartições postais põem nas estampilhas da correspondência.  {c1::sobrecarga}","Exemplo: quote|São autores do crime de importação, ou de tentativa dessa importação, o dono, o capitão ou mestre, o piloto e o contramestre da embarcação, e o sobrecarga."
" Acto ou efeito de socorrer; auxílio. Protecção, amparo.  {c1::socorro}","Exemplo: Entre estas, pode-se destacar a sua luta contra a rainha das amazonas, Pentesileia, que veio com as suas tropas em socorro dos troianos e perdeu a vida às suas mãos."
" Corpo metálico, de que a soda é o óxido.  {c1::sódio}","Exemplo: gov/Disorders/Patient-Caregiver-Education/Fact-Sheets/Creutzfeldt-Jakob-Disease-Fact-Sheet|arquivodata=4 de julho de 2017}} A dor pode ser aliviada com opioides, enquanto o clonazepam ou o valproato de sódio podem ajudar com os movimentos involuntários."
"Os hormônios (ou fatores) hipotalâmicos de liberação e de  inibição de maior importância incluem: '''Hormônio liberador de tireotrofina (TRH)''', que ocasiona a liberação do hormônio tireoestimulante; '''Hormônio liberador de corticotrofina (CRH)''', que induz a liberação de adrenocorticotropina; '''Hormônio liberador do hormônio do crescimento (GHRH)''', que promove a  liberação do hormônio do crescimento; '''Hormônio inibidor de GH (Somatostatina)''', de efeito oposto; '''Hormônio liberador de gonadotrofinas (GnRH)''', que causa liberação dos dois hormônios gonadotrópicos, hormônio luteinizante (LH) e hormônio folículo - estimulante (FSH); '''Hormônio inibidor de prolactina (dopamina)''', que causa inibição da secreção de prolactina e o '''Hormônio liberador de prolactina (PRH'''), de efeito contrário.",
Forma afrancesada de _Sunda_.  {c1::sonda},"Exemplo: Outras observações recentes, como a análise da poeira cometária coletada pela sonda espacial ''Stardust'', estão cada vez mais obscurecendo a distinção entre cometas e asteroides,{{citar vídeo|título=Comet dust seems more ‘asteroidy’ |medium=audio podcast |revista=Scientific American |data=25-01-2008|url=http://www."
A compressão do colo do útero com cateter com balão ({c1::sonda foley}) inflado com soro para dilatar o cérvix estimula a liberação de prostaglandinas nos tecidos que iniciam o trabalho de parto.,
"Em caso de necessidade, em crianças mais novas, é possível administrar a solução através de uma {c1::sonda nasogástrica}.",
" Sono imperfeito. Momento de transição, entre o estado de quem dorme e o acordar. Disposição para dormir; modorra.  {c1::sonolência}","Exemplo: Tontura, cefaleia, sonolência."
"Entre outros compositores importantes destacam-se: Alberto Williams (1862-1952), da Argentina, Enrique Soro (1884-1954) e Domingo Santa Cruz Wilson (1899-1987), do Chile, Manuel Ponce (1882-1948), do México, e Eduardo Fabini, do Uruguai.",
"Para aumentar as mamas, algumas mulheres submetem-se a cirurgias plásticas de enchimento interno com silicone ou sacos de {c1::soro fisiológico}.",
"lt;/ref&gt; Para o tratamento de picadas de escorpiões, aranhas e serpentes venenosas, o sorologista Vital Brazil criou os soros antiescorpiônico, antiaracnídeo e antiofídico.",
 O mesmo que _seroterapia_.  {c1::soroterapia},"Exemplo: align=&quot;center&quot;|&quot;por seu trabalho na soroterapia, especialmente sua aplicação contra a difteria, pela qual ele abriu um novo caminho no domínio da ciência médica e, assim, colocou nas mãos do médico uma arma vitoriosa contra as doenças e as mortes&quot;{{citar web|título=The Nobel Prize in Physiology or Medicine 1901|url=http://www."
 Acto ou efeito de soterrar^1.  {c1::soterramento},"Exemplo: A teoria biogênica do petróleo sugere que o petróleo extraído da crosta terrestre teria origem comum ao carvão mineral, já que ele também é encontrado soterrado, tendo sido gerados em função do efeito de fossilização de animais e plantas, provocado pela ação de pressão e temperatura muito altas geradas há milhões de anos no processo de soterramento de material orgânico que por algum motivo não entrou na cadeia alimentar antes ou quando foi enterrado."
 Que está por baixo da cútis.  {c1::subcutâneo},Exemplo: Na porção meridional da América do Sul o óleo extraído da gordura subcutânea das capivaras é usado como remédio.
